<?xml version="1.0" encoding="UTF-8" standalone="yes"?>
<xs:schema version="1.0" xmlns:xs="http://www.w3.org/2001/XMLSchema">
	<xs:include schemaLocation="../global_types.xsd" />
	<xs:element name="party_exp_mod_table">
		<xs:complexType>
			<xs:sequence>
				<xs:element name="level_diff_mod" minOccurs="0" maxOccurs="unbounded">
					<xs:complexType>
						<xs:attribute name="level_diff" type="xs:int" use="required"/>
						<xs:attribute name="mods" type="IntListType" use="required"/>
					</xs:complexType>
				</xs:element>
			</xs:sequence>
		</xs:complexType>
	</xs:element>
</xs:schema>
